{
  "schema_version": "1.0.0",
  "case_id": "1FDV-23-0001009",
  "generated_at": "2026-07-15T12:00:00-10:00",
  "source_snapshot": {
    "notion_actor_database": {
      "resource_id": "notion.actor-database.012b819e",
      "title": "CASEBRAIN actor database",
      "uri": "https://app.notion.com/p/1f317bb4fd9e45e0a3dd5c9a64cc0e56",
      "source_system": "notion",
      "source_class": "working_index",
      "authority_level": "work_product",
      "link_status": "linked",
      "content_hash": null,
      "last_checked_at": "2026-07-15T12:00:00-10:00",
      "sensitivity": "private",
      "notes": "29-row source snapshot reviewed 2026-07-15; row-level allegations are not promoted."
    },
    "drive_exhibit_manifest": {
      "resource_id": "drive.exhibit-manifest.1uC8lh2W",
      "title": "CASEBRAIN exhibit manifest",
      "uri": "https://docs.google.com/spreadsheets/d/1uC8lh2WtPOvogUYYq07bccS8znEfpQso6MNoTKLotiE/edit",
      "source_system": "google_drive",
      "source_class": "working_index",
      "authority_level": "work_product",
      "link_status": "linked",
      "content_hash": null,
      "last_checked_at": "2026-07-15T12:00:00-10:00",
      "sensitivity": "restricted",
      "notes": "Five populated exhibit rows observed; only some rows carried hashes."
    },
    "aeon_truth_contract": {
      "resource_id": "github.aeon777.pr51",
      "title": "AEON-777 CASEBRAIN truth contract",
      "uri": "https://github.com/GlacierEQ/AEON-777/pull/51",
      "source_system": "github",
      "source_class": "system_contract",
      "authority_level": "work_product",
      "link_status": "linked",
      "content_hash": null,
      "last_checked_at": "2026-07-15T12:00:00-10:00",
      "sensitivity": "private",
      "notes": "Open pull request; canonical only after review and merge."
    }
  },
  "policy": {
    "github_canonical": true,
    "notion_projection_only": true,
    "allegations_promoted": false,
    "verified_live_claims": false,
    "minor_pii_allowed": false,
    "human_review_required": true
  },
  "quality_summary": {
    "source_actor_rows": 29,
    "distinct_actor_keys": 31,
    "rows_with_allegation_text": 26,
    "rows_missing_review_status": 9,
    "rows_missing_numeric_evidence_count": 25,
    "actors_with_external_file_candidates": 19,
    "identity_conflicts_open": 5,
    "evidence_count_trusted": false
  },
  "actors": [
    {
      "actor_id": "actor-all-island-towing",
      "actor_key": "all_island_towing",
      "display_name": "All Island Towing",
      "aliases": [],
      "actor_type": "service_provider",
      "case_role": "service_provider",
      "priority": "P2",
      "profile_status": "source_linked",
      "identity_status": "unverified",
      "sensitivity": "private",
      "container_tag": "other",
      "known_context": [
        {
          "text": "A work-product actor row exists for All Island Towing; identity, role, and substantive assertions require source-level review.",
          "claim_class": "system_state",
          "verification_status": "pending_review",
          "source_ids": [
            "notion.actor-database.012b819e"
          ]
        },
        {
          "text": "The source row contains allegation text. This registry deliberately records only its presence and does not promote the allegation into a fact.",
          "claim_class": "system_state",
          "verification_status": "pending_review",
          "source_ids": [
            "notion.actor-database.012b819e"
          ]
        },
        {
          "text": "One or more external file candidates are linked. Their contents have not been authenticated, normalized, hashed, or accepted as verified claims in this actor layer.",
          "claim_class": "system_state",
          "verification_status": "pending_review",
          "source_ids": [
            "drive.towing.briefing.1orf"
          ]
        }
      ],
      "source_links": [
        {
          "resource_id": "notion.actor-row.all-island-towing",
          "title": "Notion actor row — All Island Towing",
          "uri": "https://app.notion.com/a9df802661ab44bb890c43477f389211",
          "source_system": "notion",
          "source_class": "work_product",
          "authority_level": "work_product",
          "link_status": "linked",
          "content_hash": null,
          "last_checked_at": "2026-07-15T12:00:00-10:00",
          "sensitivity": "private",
          "notes": "Index row is work product and may contain allegations; it is not an authenticated evidentiary record."
        },
        {
          "resource_id": "drive.towing.briefing.1orf",
          "title": "Master briefing work product referencing towing",
          "uri": "https://drive.google.com/file/d/1orf9MOcZYjqBZxGNTr5dJpsbcTlHfjo5",
          "source_system": "google_drive",
          "source_class": "work_product",
          "authority_level": "work_product",
          "link_status": "candidate",
          "content_hash": null,
          "last_checked_at": "2026-07-15T12:00:00-10:00",
          "sensitivity": "private",
          "notes": "Candidate pointer only; authenticate, hash, and review before evidentiary use."
        }
      ],
      "relationships": [],
      "open_questions": [
        "Which primary or official record confirms this actor's exact identity and case role?",
        "Which linked candidate files can be exported, hashed, authenticated, and tied to a dated event?"
      ],
      "last_reviewed_at": "2026-07-15T12:00:00-10:00"
    },
    {
      "actor_id": "actor-casey-lee-del-carpio-barton",
      "actor_key": "casey_lee_del_carpio_barton",
      "display_name": "Casey Lee Del Carpio Barton",
      "aliases": [],
      "actor_type": "person",
      "case_role": "party_self",
      "priority": "P0",
      "profile_status": "source_linked",
      "identity_status": "unverified",
      "sensitivity": "private",
      "container_tag": "shared",
      "known_context": [
        {
          "text": "A work-product actor row exists for Casey Lee Del Carpio Barton; identity, role, and substantive assertions require source-level review.",
          "claim_class": "system_state",
          "verification_status": "pending_review",
          "source_ids": [
            "notion.actor-database.012b819e"
          ]
        },
        {
          "text": "One or more external file candidates are linked. Their contents have not been authenticated, normalized, hashed, or accepted as verified claims in this actor layer.",
          "claim_class": "system_state",
          "verification_status": "pending_review",
          "source_ids": [
            "drive.casey.declaration.1pg2",
            "drive.casey.service-cert.1eor"
          ]
        }
      ],
      "source_links": [
        {
          "resource_id": "notion.actor-row.casey-lee-del-carpio-barton",
          "title": "Notion actor row — Casey Lee Del Carpio Barton",
          "uri": "https://app.notion.com/2941a906b29940a2a8167979934910c2",
          "source_system": "notion",
          "source_class": "work_product",
          "authority_level": "work_product",
          "link_status": "linked",
          "content_hash": null,
          "last_checked_at": "2026-07-15T12:00:00-10:00",
          "sensitivity": "private",
          "notes": "Index row is work product and may contain allegations; it is not an authenticated evidentiary record."
        },
        {
          "resource_id": "drive.casey.declaration.1pg2",
          "title": "Casey declaration candidate",
          "uri": "https://docs.google.com/document/d/1pg2HqFyqIeN68UBai-dSYzvQ_c9BwOeA2De13TpBypo",
          "source_system": "google_drive",
          "source_class": "filing_candidate",
          "authority_level": "primary_candidate",
          "link_status": "candidate",
          "content_hash": null,
          "last_checked_at": "2026-07-15T12:00:00-10:00",
          "sensitivity": "restricted",
          "notes": "Candidate pointer only; authenticate, hash, and review before evidentiary use."
        },
        {
          "resource_id": "drive.casey.service-cert.1eor",
          "title": "Casey service certificate candidate",
          "uri": "https://docs.google.com/document/d/1eorOu717rIVGINpiZWluOYjioy4HoSQUtBoslezK0eg",
          "source_system": "google_drive",
          "source_class": "service_record_candidate",
          "authority_level": "primary_candidate",
          "link_status": "candidate",
          "content_hash": null,
          "last_checked_at": "2026-07-15T12:00:00-10:00",
          "sensitivity": "restricted",
          "notes": "Candidate pointer only; authenticate, hash, and review before evidentiary use."
        }
      ],
      "relationships": [],
      "open_questions": [
        "Which primary or official record confirms this actor's exact identity and case role?",
        "Which linked candidate files can be exported, hashed, authenticated, and tied to a dated event?"
      ],
      "last_reviewed_at": "2026-07-15T12:00:00-10:00"
    },
    {
      "actor_id": "actor-charles-brower",
      "actor_key": "charles_brower",
      "display_name": "Charles Brower",
      "aliases": [],
      "actor_type": "person",
      "case_role": "third_party",
      "priority": "P2",
      "profile_status": "source_linked",
      "identity_status": "unverified",
      "sensitivity": "private",
      "container_tag": "brower",
      "known_context": [
        {
          "text": "A work-product actor row exists for Charles Brower; identity, role, and substantive assertions require source-level review.",
          "claim_class": "system_state",
          "verification_status": "pending_review",
          "source_ids": [
            "notion.actor-database.012b819e"
          ]
        },
        {
          "text": "The source row contains allegation text. This registry deliberately records only its presence and does not promote the allegation into a fact.",
          "claim_class": "system_state",